Question,Answer
What services does your fintech company offer?,"We offer a range of financial services, including banking, investments, loans, and more."
How can I open an account with your company?,"To open an account, visit our website and follow the online application process."
What is the minimum balance requirement for the accounts?,The minimum balance requirement varies based on the type of account. Please check our website for details.
Can I link multiple bank accounts to your platform?,"Yes, you can link multiple bank accounts to your profile for easy management."
How do I reset my password?,You can reset your password through the 'Forgot Password' option on the login page.
What security measures are in place to protect my financial information?,We use advanced encryption and security protocols to safeguard your financial information.
Are there any transaction fees associated with using your services?,Transaction fees may apply. Please refer to our fee schedule on the website for details.
How can I transfer money between accounts?,"To transfer money between accounts, log in to your account and use the 'Transfer Funds' feature."
What investment options do you provide?,"We offer a variety of investment options, including stocks, bonds, and mutual funds."
Can I get a loan through your platform?,"Yes, we provide loan services. The interest rate depends on various factors, and you can find details on our website."
What is the interest rate on loans?,"To check your account balance, log in to your account or use our mobile app."
How do I check my account balance?,Report a lost or stolen card immediately by contacting our 24/7 customer support hotline.
What is the process for reporting a lost or stolen card?,We adhere to strict privacy policies to ensure the confidentiality of customer data. Please review our privacy policy for details.
How does your company handle customer data privacy?,"Yes, you can set up automatic bill payments through your account settings."
Can I set up automatic bill payments through your platform?,"While we provide general financial information, we recommend consulting a financial advisor for personalized advice."
Do you provide financial advice?,"Contact our customer support team via phone, email, or live chat for assistance."
How can I contact customer support?,Two-factor authentication adds an extra layer of security by requiring a second form of verification.
What is two-factor authentication?,The daily withdrawal limit from ATMs depends on your account type. Check our website for details.
What is the daily withdrawal limit from ATMs?,You can download your transaction history in various formats from your account dashboard.
How do I download my transaction history?,We support a wide range of currencies. Check our supported currencies list for details.
What currencies do you support?,"Yes, your money is insured up to a certain limit. Refer to our insurance policy for more information."
Is my money insured with your company?,"To close your account, contact our customer support team for guidance on the process."
What is the process for closing my account?,"Yes, you can customize account notifications, including alerts for transactions, balances, and more."
Can I customize my account notifications?,"To dispute a transaction, fill out the dispute form on our website or contact customer support."
How do I dispute a transaction?,"You can set up alerts for account balances, large transactions, and other account activities."
What types of alerts can I set up for my account?,"Yes, we offer a mobile app for convenient access to your accounts on the go."
Do you offer a mobile app?,Account statements are generated monthly and can be viewed/downloaded from your account dashboard.
How often are account statements generated?,"Yes, you can schedule recurring transfers for convenience."
Can I schedule recurring transfers?,"To update your personal information, log in to your account and go to the profile settings."
Hello,"Welcome, how can I help you?"
Tell me about yourself,"Oops, I am designed for squadco hackathon!"
tranfuse is what?,"TranFuse is the cutting-edge platform that seamlessly blends transactions, ensuring security, efficiency, and a user-friendly experience. Experience the future of bundled payments today."
transfuse is what?,"TranFuse is the cutting-edge platform that seamlessly blends transactions, ensuring security, efficiency, and a user-friendly experience. Experience the future of bundled payments today."
what is tranfuse?,"TranFuse is the cutting-edge platform that seamlessly blends transactions, ensuring security, efficiency, and a user-friendly experience. Experience the future of bundled payments today."
what is is transfuse?,"TranFuse is the cutting-edge platform that seamlessly blends transactions, ensuring security, efficiency, and a user-friendly experience. Experience the future of bundled payments today."
